{
  "schema_version": "collector_fixture.v1",
  "source_id": "claude_code",
  "collector_id": "desktop_quota_status",
  "input_fixture_paths": [],
  "emitted_records": [
    {
      "record_type": "agent_status_snapshots",
      "sample": {
        "source_id": "claude_code",
        "collector_id": "desktop_quota_status",
        "status": "ok",
        "rate_limit_window": "weekly",
        "remaining_ratio": 0.53,
        "reset_at": "2026-07-18T05:00:00Z",
        "account_identifier_hash": "sha256_desktop_account_fixture",
        "organization_identifier_hash": "sha256_desktop_organization_fixture",
        "observed_at": "2026-07-14T19:00:00Z"
      }
    },
    {
      "record_type": "source_plan_profiles",
      "sample": {
        "source_id": "claude_code",
        "collector_id": "desktop_quota_status",
        "plan_label": "Claude Desktop subscription",
        "quota_basis": "local_desktop_session_usage",
        "account_identifier_hash": "sha256_desktop_account_fixture",
        "organization_identifier_hash": "sha256_desktop_organization_fixture",
        "confidence": "observed"
      }
    }
  ],
  "upload_policy": {
    "uploads_raw_content": false,
    "boundary": "Normalized quota and credit values, timestamps, and hashed account and organization identifiers only. Local authentication material and raw responses are never persisted or uploaded.",
    "redacts": [
      "prompt",
      "response",
      "tool_output",
      "command_output",
      "local_path",
      "credential",
      "api_key",
      "cookie",
      "password",
      "secret"
    ]
  }
}
