{
  "schema_version": "collector_fixture.v1",
  "source_id": "pi",
  "collector_id": "local_sessions",
  "input_fixture_paths": [
    "../../../fixtures/local_sessions/minimal-session.jsonl"
  ],
  "emitted_records": [
    {
      "record_type": "local_usage_snapshots",
      "sample": {
        "source_id": "pi",
        "session_hash": "pi_fixture_session_hash",
        "workspace_hash": "workspace_sha256_fixture",
        "started_at": "2026-05-20T08:10:00Z",
        "input_tokens": 700,
        "cache_read_tokens": 100,
        "cache_write_tokens": 40,
        "output_tokens": 160,
        "total_cost_usd": 0.0033,
        "billing_provider": "openai",
        "model_provider": "openai",
        "billing_channel": "subscription",
        "auth_mode": "oauth",
        "subscription_product": "chatgpt_plus"
      }
    },
    {
      "record_type": "local_usage_session_titles",
      "sample": {
        "source_id": "pi",
        "session_hash": "pi_fixture_session_hash",
        "session_display_name": "Fixture session",
        "session_display_name_source": "summary",
        "metadata_policy": "organization_and_user_enabled"
      }
    },
    {
      "record_type": "local_usage_workspace_labels",
      "sample": {
        "source_id": "pi",
        "workspace_hash": "workspace_sha256_fixture",
        "workspace_display_label": "Fixture workspace",
        "workspace_label_source": "user_approved",
        "metadata_policy": "organization_and_user_enabled"
      }
    },
    {
      "record_type": "local_usage_collector_statuses",
      "sample": {
        "source_id": "pi",
        "collector_id": "local_sessions",
        "status": "ok",
        "last_collected_at": "2026-05-20T08:11:00Z",
        "records_emitted": 1
      }
    }
  ],
  "upload_policy": {
    "uploads_raw_content": false,
    "boundary": "Aggregate Pi usage, explicit route attribution, app-reported costs, hashed identifiers, and collector health only.",
    "redacts": [
      "prompt",
      "response",
      "tool_output",
      "command_output",
      "local_path",
      "credential",
      "api_key",
      "cookie",
      "password",
      "secret"
    ]
  }
}
